Titulo,Director,Pais,Año,Genero,Duración (Minutos),Protagonistas,Idioma,Producción,Guion,Música,Fotografía,Vestuario,Productora,Presupuesto (Dólares),Recaudación (Dólares),Ganador
Vor: el ladrón,Pável Chujrái,Rusia,1997,Crímenes,96,"Vladimir Mashkov, Yekaterina Rednikova, Mikhail Filipchuk, Yury Belyayev",Ruso,"Igor Tolstunov, Sergey Kozlov",Pável Chujrái,Vladimir Dashkevich,Vladimir Klimov,Natalya Moneva,"NTV-Profit, Roissy Films, Productions Le Pont",,,0
La vida es bella,Roberto Benigni,Italia,1998,Drama,116,"Roberto Benigni Nicoletta Braschi, Giorgio Cantarini",Italiano,"Elda Ferri, Gianluigi Braschi","Roberto Benigni, Vincenzo Cerami","Nicola Piovani, Jacques Offenbach",Tonino Delli Colli,Danilo Donati,"Melampo Cinematografica, Cecchi Gori Group, Miramax",20000000,229163264,1
Central do Brasil,Walter Salles,"Brasil, Francia",1998,Drama,115,"Fernanda Montenegro, Marília Pêra Vinicius de Oliveira, Soia Lira","Portugués, Alemán",Videofilmes - MACT Productions,"Joáo Emanuel Carneiro, Marcos Bernstein","Antonio Pinto, Jaques Morelenbaum",Walter Carvalho,,,,22000000,0
Bacheha-Ye aseman,Majid Majidi,Irán,1998,drama,89,Amir Farrokh Hashemian Bahare Seddiqi,persa,Amir Esfandiari y Mohammad Esfandiari,Majid Majidi,,Parviz Malekzaade,,,150000,1628579,0
El abuelo,José Luis Garci,España,1998,Drama,146,"Fernando Fernán Gómez, Rafael Alonso, Cayetana Guillén Cuervo, Agustín González, Cristina Cruz Mínguez, Alicia Rozas, Fernando Guillén, Francisco Algora, Emma Cohen, María Massip, Antonio Valero, Francisco Piquer",Español,José Luis Garci,"José Luis Garci, Horacio Valcárcel",Manuel Balboa,Raúl Pérez Cubero,Gumersindo Andrés López,,,,0
Tango,Carlos Saura,España,1998,Musical,115,"25 personas, Miguel Ángel SoláCecilia Narova, Mía Maestro, Juan Carlos Copes, Carlos Rivarola, Sandra Ballesteros, Oscar Cardozo Ocampo, Enrique Pinti, Julio Bocca, Juan Luis Galiardo, Martín Seefeld, Néstor Marconi, Juanjo Domínguez, Horacio Salgán, Ubaldo de Lío, Antonio Agri, Sebastián Arce, Eduardo Cutuli, Mabel Pesen, Ricardo Díaz Mourelle, Julio Marticorena, Nora Zinski, Elvira Onetto, Cynthia Avila, Jorge Dorio",Español,Carlos Mentasti Luis A. Scalella,Carlos Saura,Lalo Schifrin,Vittorio Storaro,Beatriz De Benedetto,"Argentina Sono Film, Adela Pictures, Alma Ata International Pictures S.L.Hollywood Partners",4685408,1687311,0
Todo sobre mi madre,Pedro Almodóvar,España,1999,Comedia dramática,101,"Cecilia Roth, Marisa Paredes, Candela Peña, Antonia San Juan, Penélope Cruz",Español,"Pedro Almodóvar, Agustín Almodóvar",Pedro Almodóvar,Alberto Iglesias,Affonso Beato,Bina Daigeler,"El Deseo, Renn Productions, France 2 Cinéma, Vía Digital",4000000,67872296,1
La vida prometida,Olivier Dahan,Francia,1999,Drama,,"12 personas, Isabelle Huppert, Pascal Greggory, Maud Forget, Fabienne Babe, André Marcon, Abdelkader, Denis Braccini, Frédéric Maranber, Irène Ismaïloff, Janine Souchon, Louis-Do de Lencquesaing, Volker Marek",Francés,,,,,Gigi Lepage,,,,0
Wò hǔ cáng lóng,Ang Lee,"Taiwán, Hong Kong, China, Estados Unidos",2000,Wuxia,120,"Chow Yun-Fat, Michelle Yeoh, Zhang Ziyi, Chang Chen, Cheng Pei-pei",chino mandarín,"Li-Kong Hsu, William Kong, Ang Lee","Hui-Ling Wang, James Schamus, Kuo Jung Tsai, Wang Du Lu",Tan Dun,Peter Pau,Timmy Yip,"Columbia Pictures, Tri, Star Pictures",17000000,213500000,1
Amores Perros,Alejandro González Iñárritu,México,2000,Drama,154,"Emilio Echevarría, Gael García Bernal, Goya ToledoÁlvaro Guerrero",Español,Alejandro González Iñárritu,Guillermo Arriaga,Gustavo Santaolalla,Rodrigo Prieto,Gabriela Diaque,"Altavista Films, Zeta Films",2400000,20908467,0
Para todos los gustos,Agnès Jaoui,Francia,2000,Comedia dramática,112,"Agnès Jaoui, Jean-Pierre Bacri, Anne Alvaro, Alain Chabat, Gérard Lanvin, Brigitte Catillon, Christiane Millet",Francés,"Christian Bérard, Charles Gassot","Agnès Jaoui, Jean-Pierre Bacri",,Laurent Dailland,Jackie Budin,"Téléma, Les Films A4France 2 Cinéma",9000000,23600000,0
En tierra de nadie,Danis Tanović,"Bosnia y Herzegovina, Eslovenia, Bélgica, Francia, Italia, Reino Unido",2001,Bélico,98,"Branko Djuric, Rene Bitorajac, Filip Sovagovic, Katrin Cartlidge, Simon Callow, Serge-Henri Valche, Georges Siatidis","Bosnio, Serbio, Croata, Francés, Inglés, Alemán","Cédomir Kolar, Marc Baschet, Frédérique Dumas-Zajdela",Danis Tanović,Danis Tanović,Walther Vanden Ende,,"Fabrica, Man's Films, Studio Maj",14000000,,1
Amélie,Jean-Pierre Jeunet,Francia,2001,Comedia,122,"Audrey Tautou, Mathieu Kassovitz, Rufus, Lorella Cravotta",Francés,"Claudie Ossard, Arne Meerkamp van Embden",Guillaume Laurant,Yann Tiersen,Bruno Delbonnel,Madeline Fontaine,"Claudie Ossard Productions, Union Générale Cinématographique",77000000,174605902,0
Elling,Petter Naess,Noruega,2001,Comedia dramática,89,"Per Christian Ellefsen, Sven Nordin, Marit Pia Jacobsen, Jørgen Langhelle, Per Christensen",Noruego,Dag Alveberg,Axel Hellstenius,Lars Lillo-Stenberg,Svein Krøvel,,"Maipo Film- og TV Produksjon, TNT Film Productions",,,0
Lagaan,Ashutosh Gowariker,India,2001,"Drama, Musical.",224,"Aamir Khan, Paul Blackthorne",Hindi,"Aamir Khan, Jhamu Sughand","Ashutosh Gowariker, Kumar Dave, Sanjay Dayma, K. P. Saxena",A. R. Rahman,Anil Mehta,,Aamir Khan Productions,250000000,,0
El hijo de la novia,Juan José Campanella,Argentina,2001,"Drama, romance",123,"Ricardo Darín, Héctor Alterio, Norma Aleandro, Natalia Verbeke, Eduardo Blanco",español,Adrián Suar,Juan José Campanella  Fernando Castets,Ángel Illarramendi  Iván Wyszogrod,Daniel Shulman,Cecilia Monti,Patagonik Film Group,2000000,8597323,0
Nirgendwo in Afrika,Caroline Link,Alemania,2002,Drama,141,"Juliane Köhler, Merab Ninidze",alemáningléssuajili,Peter Herrmann,"Caroline Link, Stefanie Zweig",Niki Reiser,Gernot Roll,Barbara Grupp,"MTM Medien & Television München, Constantin Film, Bavaria Film, Media Cooperation One",7000000,,1
El crimen del padre Amaro,Carlos Carrera,México,2002,Drama,118,"Gael García Bernal, Ana Claudia Talancón, Sancho Gracia, Angélica Aragón, Luisa Huertas, Pedro Armendáriz Jr.Ernesto Gómez Cruz, Gastón Melo, Damián Alcázar",Español,"Daniel Birman Ripstein, Alfredo Ripstein",Vicente Leñero,Rosino Serrano,Guillermo Granillo,María Estela Fernández,"Alameda Films, Artcam International, Blu Films, FOPROCINE",20870896000000,283642624000000,0
Hero,Zhang Yimou,China,2002,Drama,99,"Jet Li, Tony Leung Chiu Wai, Maggie Cheung, Zhang Ziyi, Chen Daoming, Donnie Yen",Chino mandarín,Zhang Yimou,"Feng Li, Bin Wang, Zhang Yimou",Tan Dun,Christopher Doyle,Emi Wada,Sil-Metropole Organisation,,177395557,0
Un hombre sin pasado,Aki Kaurismäki,"Finlandia, Alemania, Francia",2002,Drama,93,"Markku Peltola, Kati Outinen, Annikki Tähti, Juhani NiemeläKaija Pakarinen",Finés,Aki Kaurismäki,Aki Kaurismäki,Leevi Madetoja,Timo Salminen,Outi Harjupatana,Sputnik Oy,,9564237,0
Zus & Zo,Paula van der Oest,Países Bajos,2002,Comedia romántica,106,"17 personas, Monic Hendrickx, Jacob Derwig, Halina Reijn, Anneke Blok, Theu Boermans, Annet Nieuwenhuyzen, Mike Reus, Marisa van Eyle, Lineke Rijxman, Annet Malherbe, Josine van Dalsum, Jappe Claes, Lore Dijkman, Marnie Blok, Johan Ooms, Marie Louise Stheins, Harry van Rijthoven",Neerlandés,,Paula van der Oest,Fons Merkies,,,,,,0
Las invasiones bárbaras,Denys Arcand,CanadáFrancia,2003,Drama,99,"Rémy Girard, Stéphane Rousseau, Dorothée Berryman, Marie-Josée Croze, Louise Portal",Francés,"Daniel Louis, Denys Robert",Denys Arcand,Pierre Aviat,Guy Dufaux,Denis Sperdouklis,Canal+Canadian Film Development Corporation,5000000,,1
Ondskan,Mikael Håfström,"Suecia, Dinamarca",2003,Drama,114,Andreas Wilson  Linda Zilliacus  Henrik Lundström  Gustaf Skarsgård  Jesper Salén,"Sueco, Finlandés",,"Mikael Håfström, Hans Gunnarsson",Francis Shaw,Peter Mokrosinski,,,20000000,,0
El ocaso del samurái,Yôji Yamada,Japón,2003,Drama,129,Hiroyuki Sanada Rie Miyazawa Nenji Kobayashi Ren Osugi Reiko Kusamura Min Tanaka Tetsuro Tamba,Japonés,,Yôji Yamada Yoshitaka Asama,Isao Tomita,Mutsuo Naganuma,,Shochiku Films,,7372769,0
Mar adentro,Alejandro Amenábar,"España, Italia, Francia",2004,"Drama, Biográfica",125,"Javier Bardem, Belén Rueda, Lola Dueñas, Mabel Rivera, Celso Bugallo","Español, Gallego, Catalán","Fernando Bovaira, Alejandro Amenábar","Alejandro Amenábar, Mateo Gil","Alejandro Amenábar, Carlos Núñez",Javier Aguirresarobe,Sonia Grande,"Fine Line Features, New Line Cinema, Sogecine, Sogepaq, Himenóptero, Televisión Española, Canal+",10000000,1983747283,1
As It Is in Heaven,Kay Pollak,Suecia,2004,drama,132,"Michael Nyqvist, Frida Hallgren, Helen Sjöholm",suecoinglés,"Anders Birkeland, Göran Lindström","Kay Pollak, Ola Olsson, Carin Pollak, Margaretha Pollak, Anders Nyberg",Stefan Nilsson,Harald Paalgard,,"GF Studios, Sonet Film",,,0
Les Choristes,Christophe Barratier,Francia,2004,Drama,1,"Gérard Jugnot, Jean-Baptiste Maunier, François Berléand, Jacques Perrin, Maxence Perrin",Francés,"Arthur Cohn, Jacques Perrin, Gérard Jugnot","Christophe Barratier, Philippe Lopes-Curval","Bruno Coulais, Christophe Barratier","Carlo Varini, Dominique Gentil",,Galatée Films  Pathé Renn Productions  France 2 Cinéma  Novo Arturo Films,,,0
Der Untergang,Oliver Hirschbiegel,Alemania,2004,Bélico,156,"Bruno Ganz, Alexandra Maria Lara, Corinna Harfouch, Ulrich Matthes, Juliane Köhler, Heino Ferch, Christian Berkel, Thomas Kretschmann",Alemán,Bernd Eichinger,Bernd Eichinger,Stephan Zacharias,Rainer Klausmann,,Newmarket Capital Group,13500000,92180910,0
Yesterday,Darrell Roodt,Sudáfrica,2004,Ficción,96,"Leleti Khumalo, Lihle Mvelase Kenneth Kambule, Harriet Lehabe, Camilla Walker",Zulú,Videovision Entertainment,Darrell James Roodt,"Mpahleni Latozi, Smiles Makhama , The Beatles",Michael Brierley,,,,,0
Tsotsi,Gavin Hood,"Sudáfrica, Reino Unido",2005,Drama,94,Presley Chweneyagae,"isi, Zulu",Peter Fudakowski,Gavin Hood,"Vusi Mahlasela, Mark Kilian, Paul Hepker",Lance Gewer,,,3000000,9879971,1
Joyeux Noël,Christian Carion,Francia,2005,"Drama, historia, guerra",115,"Daniel Brühl, Guillaume Canet, Diane Kruger, Benno Fürmann, Gary Lewis, Bernard Le Coq, Suzanne Flon, Andy Serkis, Natalie Dessay, Rolando Villazón, Ignacio Soto",francés,Christopher Rossignon,Christian Carion,Philipe Rombi,Walter Vande Ende,,,,,0
Paradise Now,Hany Abu-Assad,"Israel, Francia, Alemania, Palestina, Países Bajos",2005,Drama,90,"Kais Nashef, Ali Suliman, Lubna Azabal, Amer Hlehel, Hiam Abbass",árabeinglés,Bero Beyer,"Hany Abu-Assad, Bero Beyer, Pierre Hodgson",,Antoine Héberlé,Walid Maw'ed,"Augustus Film, Lama Films, Razor Film, Lumen Films, Hazaza, HArte France Cinéma",,,0
Sophie Scholl - Los últimos días,Marc Rothemund,Alemania,2005,Drama,120,"Julia Jentsch, Fabian Hinrichs",Alemán,"Fred Breinersdorfer Sven Burgemeister, Christoph Müller Marc Rothermund",Fred Breinersdorfer,"Reinhold Heil, Johnny Klimek",Martin Langer,,"Goldkind Film, Broth Film, Bayerischer Rundfunk, Südwestrundfunk, Arte",,,0
La vida de los otros,Florian Henckel von Donnersmarck,Alemania,2006,Drama,137,"Ulrich Mühe Martina Gedeck Sebastian Koch, Ulrich Tukur",alemán,"Quirin Berg, Max Wiedemann, Dirk Hamm",Florian Henckel von Donnersmarck,Gabriel Yared Stéphane Moucha,Hagen Bogdanski,,"Wiedemann & Berg, Bayerischer Rundfunk, ARTECreado Film",2000000,,1
Después de la boda,Susanne Bier,"Dinamarca, Suecia",2006,Drama,120,Mads Mikkelsen  Sidse Babett Knudsen,Inglés,Sisse Graum Olsen,"Susanne Bier, Anders Thomas Jensen",Johan Söderqvist,Morten Søborg,,"Zentropa, After the Wedding, Sigma Films",,,0
Indigènes,Rachid Bouchareb,"Argelia, Francia, Marruecos, Bélgica",2006,Bélica,120,"Jamel Debbouze, Samy Nacéri, Sami Bouajila, Roschdy Zem, Bernard Blancan, Mathieu Simonet, Benoît Giros, Mélanie Laurent",francésárabe,"Jean Bréhat, Alexandre Lippens","Rachid Bouchareb, Olivier Lorelle",Armand Amar,Patrick Blossier,,Tessalit Productions,,,0
El laberinto del fauno,Guillermo del Toro,España,2006,Drama,119,"Ivana Baquero, Sergi López, Maribel VerdúDoug Jones",Español,"Bertha Navarro, Alfonso Cuarón, Frida TorresblancoÁlvaro Agustín",Guillermo del Toro,Javier Navarrete,Guillermo Navarro,Lala Huete,"Estudios Picasso, Wild Bunch, Telecinco, Tequila Gang, Esperanto Filmoj, Cafe FXICAA",13500000,87041569,0
Agua,Deepa Mehta,"India, Canadá",2006,Drama-romance,114,"Seema Biswas, Lisa Ray, John Abraham, Sarala Kariyawasam, Manorama",Hindi,David Hamilton,"Diipa Mehta, Anurag Kashyap","Mychael Danna, A. R. Rahman",Giles Nuttgens,,,,,0
Los falsificadores,Stefan Ruzowitzky,"Austria, Alemania",2007,"Policiaco, drama, bélico",95,Karl Markovics August Diehl Devid Striesow Martin Brambach August Zirner Veit Stübner Sebastian Urzendowsky Andreas Schmidt,alemán,Josef Aichholzer Nina Bohlmann Babette Schröder,Stefan Ruzowitzky.  Basado en la novela The Devil's Workshop de Adolf Burger,Marius Ruhland Hugo Díaz,Benedict Neuenfels,,Magnolia Filmproduktion Babelsberg Film Beta Cinema Filmförderung Hamburg Josef Aichholzer Filmproduktion Studio Babelsberg Motion Pictures Zweites Deutsches Fernsehen,,,1
Katyn,Andrzej Wajda,Polonia,2007,Cine bélico,115,"Maja Ostaszewska, Artur Żmijewski, Paweł Małaszyński",polaco,Michał Kwieciński,"Andrzej Mularczyk, Andrzej Wajda, Przemysław Nowakowski",Krzysztof Penderecki,Paweł Edelman,Magdalena Biedrzycka,,,15000000,0
Mongol,Sergéi Bodrov,Rusia,2007,Drama,126,"Tadanobu Asano Honglei Sun Khulan Chuluun, Aliya, Ba Sen, Amadu Mamadakov, He Qi, Ben Hon Sun",Mongol,"Sergei Selyanov, Sergéi Bodrov, Anton Melnik","Arif Aliyev, Sergéi Bodrov",Tuomas Kantelinen Altan Urag,"Sergey Trofimov, Rogier Stoffers",Emi Wada,"Kinokompaniya CTBAndreevski Flag, X-Filme Creative Pool",18000000,26403998,0
12,Nikita Mijalkov,Rusia,2007,Policíaca,159,"Serguéi Makovetski, Nikita Mijalkov, Serguéi Garmash, Valentín Gaft, Alekséi Petrenko, Yuri Stoyanov, Serguéi Gazarov, Mijaíl Yefremov, Alekséi Gorbunov, Serguéi Artsybashev, Víktor Verzhbitski, Roman Madianov, Aleksandr Adabashyan, Apti Magamayev","Ruso, Checheno","Nikita Mijalkov, Leonid Vereschaguin","Reginald Rose, Nikita Mijalkov, Aleksandr Novototski Vlasov, Vladímir Moseenko",Eduard Artiomev,Vladislav Opelyants,,"Tri, Te",25000000,4000000,0
Despedidas,Yōjirō Takita,Japón,2008,Drama,130,"Masahiro Motoki, Ryōko Hirosue, Tsutomu Yamazaki, Kimiko Yo, Kazuko Yoshiyuki, Takashi Sasano",Japonés,Toshiaki Nakazawa,Kundō Koyama,Joe Hisaishi,Takeshi Hamada,,Shochiku,,69932387,1
Der Baader Meinhof Komplex,Uli Edel,Alemania,2008,Drama,150,"Martina Gedeck, Moritz Bleibtreu, Johanna Wokalek, Bruno Ganz, Alexandra Maria Lara",Inglés,Bernd Eichinger,Bernd Eichinger,"Peter Hinderthür, Florian Tessloff",Rainer Klausmann,,Constantin Film,,,0
Entre les murs,Laurent Cantet,Francia,2008,Drama,128,"Cherif Bounaïdja Rachedi, Esmeralda Ouertani, Franck Keïta, François Bégaudeau, Juliette Demaille, Laura Baquela, Louise Grinberg, Nassim Amrabt, Nitany Gueyes, Rachel Régulier",Francés,Carole Scotta Caroline Benjo,François Bégaudeau  Robin Campillo  Laurent Cantet,,"Pierre Milon, Catherine Pujol, Georgi Lazarevski",Marie Le Garrec,Haut et Court,,,0
Revanche,Götz Spielmann,Austria,2008,Drama,121,Michael-Joachim Heiss /Johannes Krisch /Andreas Lust /Irina Potapenko /Ursula Strauss/ Johannes Thanheiser /,Alemán,Götz Spielmann,Götz Spielmann,,Martin Gschlacht,,Prisma Film,,886407,0
Waltz with Bashir,Ari Folman,Israel,2008,Documental,90,Ari Folman,Hebreo,"Ari Folman, Serge Lalou, Gerhard Meixner, Yael Nahlieli, Roman Paul",Ari Folman,Max Richter,Declan Quinn,,"Bridgit Folman Film Gang, Les Films d'Ici, Razor Film Produktion",2000000,11125849,0
El secreto de sus ojos,Juan José Campanella,Argentina,2009​,Suspenso,127,"Ricardo Darín, Soledad Villamil, Pablo Rago, Javier Godino, Guillermo Francella",Español,"Juan José Campanella, Mariela Besuievski, Carolina Urbieta, Vanessa Ragone, Axel Kuschevatzky","Juan José Campanella, Eduardo Sacheri","Federico Jusid, Emilio Kauderer",Félix Monti,Cecilia Monti,"Haddock Films, Tornasol Films100 Bares, Telefe, Televisión Española, Canal+Con el apoyo de:Gobierno de España, Ministerio de Cultura de España, ICAAInstituto Nacional de Cine y Artes Audiovisuales, ICO",2000000,56965279,1
Ajami,Scandar Copti,Israel,2009​,Drama,120,"Fouad Habash, Ibrahim Frege, Scandar Copti, Shahir Kabaha, Eran Naim","Árabe, Hebreo","Moshe Danon, Thanassis Karathanos, Talia Kleinhendler","Scandar Copti, Yaron Shani",Rabih Boukhari,Boaz Yehonatan Yaacov,,,1000000,22000000,0
La teta asustada,Claudia Llosa,Perú,2009​,Drama,93,"Magaly Solier, Susi Sánchez, Efraín Solís, Marino Ballón, Antolín Prieto",castellanoquechua sureño,"Antonio Chavarrías, Claudia Llosa, José María Morales",Claudia Llosa,Selma Mutal,Natasha Braier,,"Vela Producciones, Oberón Cinematográfica, Wanda Visión",,,0
Un Prophète,Jacques Audiard,"Francia, Italia",2009​,Drama,155,"Tahar Rahim, Niels Arestrup Antoine Basler Adel Bencherif Hichem Yacoubi Reda Kateb Jean-Philippe Ricci Pierre Leccia Foued Nassah",FrancésÁrabe,"Martine Cassinelli, Antonin Dedet","Jacques Audiard, Thomas Bidegain, Abdel Raouf Dafri, Nicolas Peufaillit",Alexandre Desplat,Stéphane Fontaine,Virginie Montel,"Celluloid Dreams, Why Not Productions, Bi, M Distribuzione, UGCFrance 2Canal+Chic Films, Page 114",13000000,,0
Das weiße Band,Michael Haneke,"Austria, Alemania, Francia, Italia",2009​,Drama,144,"Christian Friedel, Ulrich Tukur, Josef Bierbichler",alemán,"Stefan Arndt, Veit Heiduschka, Michael Katz, Margaret Ménégoz, Andrea Occhipinti",Michael Haneke,,Christian Berger,,"Wega Film, X Filme",12000000,19100000,0
Hævnen,Susanne Bier,Dinamarca,2010​,Drama,113,"Mikael Persbrandt, Trine Dyrholm, Ulrich Thomsen",danés,Sisse Graum Jørgensen,"Anders Thomas Jensen, Susanne Bier, Per Nielsen",Johan Söderqvist,Morten Søborg,,Zentropa,,,1
Biutiful,Alejandro González Iñárritu,México,2010​,Drama,147,"Javier Bardem, Rubén Ochandiano, Eduard Fernández, Maricel Álvarez, Ana Wagener",Español,"Alejandro González Iñárritu, Jon Kilik, Ann Ruark, Fernando Bovaira, Sandra Hermida, Guillermo del Toro","Alejandro González Iñárritu, Armando Bó Jr.Nicolás Giacobone",Gustavo Santaolalla,Rodrigo Prieto,,"Televisió de Catalunya, Televisión Española, Cha Cha Cha Films, Focus Features International",,25100000,0
Kynódontas,Yorgos Lanthimos,Grecia,2010​,Drama,97,"Christos Stergioglou, Michelle Valley, Aggeliki Papoulia, Mary Tsoni, Christos Passalis, Anna Kalaitzidou",Griego,"Iraklis Mavroidis, Athina Rachel Tsangari, Giorgos Tsourianis","Yorgos Lanthimos, Efthymis Filippou",,Thimios Bakatatakis,,Boo Productions,200000,384147,0
Incendies,Denis Villeneuve,Canadá,2010​,Drama,133,"13 personas, Lubna Azabal, Maxim Gaudette, Rémy Girard, Mélissa Désormeaux-Poulin, Allen Altman, Baya Belal, Mohamed Majd, Frédéric Paquet, John Dunn-Hill, Jackie Sawiris, Hind Kamel, Nabil Sawalha, Robert Auclair",Francés,"Luc Déry, Phoebe Greenberg, Ziad Touma, Anthony Doncque, Kim Mc, Craw, Penny Mancuso, Miléna Poylo","Denis Villeneuve, Wajdi Mouawad, Valérie Beaugrand-Champagne",Grégoire Hetzel,André Turpin,Sophie Lefebvre,Micro_scope,,16025025,0
Hors-la-loi,Rachid Bouchareb,Francia,2010​,Drama,140,"17 personas, Jamel Debbouze, Roschdy Zem, Sami Bouajila, Samir Guesmi, Abdelkader Secteur, Assaâd Bouab, Bernard Blancan, Chafia Boudraa, Christian Crahay, Jean-Pierre Lorit, Larbi Zekkal, Mourad Khen, Sabrina Seyvecou, Thibault de Montalembert, Corentin Lobet, Mohamed Grayaa, Alain Blazquez",Árabe,,Rachid Bouchareb,Armand Amar,Christophe Beaucarne,,,,,0
Yodaí-e Nader az Simín,Asghar Farhadi,Irán,2011​,Drama,123,"Leila Hatami, Payman Maadi, Shahab Hosseini, Sareh Bayat, Sarina Farhadi",Persa,Asghar Farhadi,Asghar Farhadi,Sattar Oraki,Mahmoud Kalari,,,500000,12800000,1
Bullhead,Michaël R. Roskam,Bélgica,2011​,Drama,128,Matthias Schoenaerts  Jeroen Perceval  Barbara Sarafian,Neerlandés,Savage Film,Michaël R. Roskam,Raf Keunen,,,,,,0
In Darkness,Agnieszka Holland,Canadá,2011​,Drama,144,"23 personas, Robert Więckiewicz, Kinga Preis, Agnieszka Grochowska, Maria Schrader, Herbert Knaup, Marcin Bosak, Benno Fürmann, Krzysztof Skonieczny, Julia Kijowska, Michal Zurawski, Piotr Glowacki, Filip Garbacz, Weronika Rosati, Joachim Paul Assböck, Ireneusz Czop, Andrzej Mastalerz, Piotr Nowak, Olena Leonenko, Etel Szyc, Maja Bohosiewicz, Jeremias Koschorz, Frank Köbe, Dorota Liliental",Polaco,Juliusz Machulski,David F. Shamoon,Antoni Łazarkiewicz,Jolanta Dylewska,,,,,0
Monsieur Lazhar,Philippe Falardeau,Canadá,2011​,Drama,94,"Mohamed Fellag, Sophie NélisseÉmilien Néron, Danielle Proulx, Brigitte Poupart, Jules Philip",francés,"Luc Déry, Kim Mc, Craw",Philippe Falardeau,Martin Léon,Ronald Plante,Francesca Chamberland,Micro_Scope,,,0
Amor,Michael Haneke,"Austria, Francia, Alemania",2012​,Drama,127,"Jean-Louis Trintignant, Emmanuelle Riva, Isabelle Huppert",francésinglés,"Margaret Ménégoz, Michael Katz, Veit Heiduschka, Stefan Arndt",Michael Haneke,Franz Schubert,Darius Khondji,,"Ver lista, X-Filme Creative Pool, Wega Film, France 3 cinéma, ARD degeto, Bayerischer Rundfunk, Westdeutscher Rundfunk, Canal+France télévisions",,29900000,1
Kon-Tiki,Joachim Rønning,Noruega,2012​,Histórica,118,"Pål Sverre Hagen, Anders Baasmo Christiansen, Gustaf Skarsgård, Tobias Santelmann",Inglés,"Aage Aaberge, Jeremy Thomas","Petter Skavlan, Allan Scott",Johan Söderqvist,Geir Hartly Andreassen,,Nordisk Film,155000000,228000000,0
No,Pablo Larraín,Chile,2012​,Drama,118,"Gael García Bernal, Alfredo Castro, Luis Gnecco, Néstor Cantillana, Antonia Zegers, Jaime Vadell, Marcial Tagle",Español,Juan de Dios Larraín  Pablo Larraín,"Pedro Peirano, A partir de la obra de teatro El plebiscito de Antonio Skármeta",Carlos Cabezas Rocuant,Sergio Armstrong,,Fábula,,2343664,0
Un asunto real,Nikolaj Arcel,Dinamarca,2012​,Drama,137,"Mads Mikkelsen, Alicia Vikander, Mikkel Følsgaard",danés,"Meta Louise Foldager, Sisse Graum Jørgensen, Louise Vesth",Nikolaj Arcel y Rasmus Heisterberg,"Gabriel Yared, Cyrille Aufort",Rasmus Videbæk,,"DRTVFilm i Väst, Sveriges Television, Zentropa",,6047932,0
War Witch,Kim Nguyen,Canadá,2012​,Drama,90,"Rachel Mwanza, Serge Kanyinda, Alain Lino Mic Eli Bastien","Francés, Lingala","Pierre Even, Marie-Claude Poulin, Kim Nguyen",Kim Nguyen,"Gabriel Yared, Cyrille Aufort",Nicolas Bolduc,,,,,0
La gran belleza,Paolo Sorrentino,Italia  Francia,2013​,"Comedia, drama",142,"29 personas, Toni Servillo, Carlo Verdone, Sabrina Ferilli, Carlo Buccirosso, Iaia Forte, Pamela Villoresi, Galatea Ranzi, Franco Graziosi, Giorgio Pasotti, Massimo Popolizio, Luca Marinelli, Serena Grandi, Vernon Dobtcheff, Dario Cantarelli, Anita Kravos, Massimo De Francovich, Roberto Herlitzka, Isabella Ferrari, Giulio Brogi, Pasquale Petrolo, Claudio Gregori, Fanny Ardant, Ivan Franek, Stefania Barca, Paolo Mazzarelli, Lorenzo Gioielli, Nicola Giuliano, Giusi Merli, Giulia Di Quilio",italiano,Nicola Giuliano  Francesca Cima,Paolo Sorrentino  Umberto Contarello,Lele Marchitelli,Luca Bigazzi,Daniela Ciancio,"Medusa Film, PathéFrance 2Indigo Film",,,1
Jagten,Thomas Vinterberg,Dinamarca,2013​,Drama,115,"Mads Mikkelsen, Thomas Bo Larsen, Annika Wedderkopp, Lasse Folgelstrøm, Susse Wold",Danés,"Morten Kaufmann, Sisse Graum Jørgensen","Tobias Lindholm, Thomas Vinterberg",Nikolaj Egelund,Charlotte Bruus Christensen,,Zentropa Entertainments,,,0
The Missing Picture,Rithy Panh,Camboya,2013​,Documental,92,"Jean-Baptiste Phou, Randal Douc",Francés,Catherine Dussart,Rithy Panh Christophe Bataille,Marc Marder,Prum Mesa,,,49768,52164,0
Omar,Hany Abu-Assad,Palestina,2013​,Suspense,96,"Adam Bakri, Leem Lubany",Árabe,"Hany Abu-Assad Waleed Zuaiter, David Gerson",Hany Abu-Assad,,Ehab Assal,,ZBROS,,,0
Ida,Paweł Pawlikowski,Polonia,2014​,Drama,82,"Agata Trzebuchowska, Agata Kulesza",Polaco,"Eric Abraham, Piotr Dzieciol, Ewa Puszczynska","Paweł Pawlikowski, Rebecca Lenkiewicz",Kristian Eidnes Andersen,"Lukasz Zal, Ryszard Lenczewski","Ola Staszko, Agata Winska","Opus Film, Phoenix Film Investments",,11100000,1
Leviatán,Andréi Zviáguintsev,Rusia,2014​,Drama,141,"Alekséi Serebryakov, Elena Lyádova, Vladímir Vdovichénkov, Román Madyánov",ruso,Alexander Rodnyansky,"Andréi Zviáguintsev, Oleg Neguin",Philip Glass,Mijaíl Krichman,,Non-Stop Production,220000000,245794,0
Mandariinid,Zaza Urushadze,"Estonia, Georgia",2014​,Drama,87,"Lembit Ulfsak, Elmo Nüganen, Mikheil Meskhi, Giorgi Nakashidze, Raivo Trass",estoniorusogeorgiano,"Ivo Felt, Zaza Urushadze",Zaza Urushadze,Niaz Diasamidze,Rein Kotov,,Allfilm,650000,,0
Timbuktu,Abderrahmane Sissako,Mauritania,2014​,Drama,100,"Ibrahim Ahmed, Toulou Kiki, Hichem Yacoubi",Tamashek,"Sylvie Pialat, Etienne Comar","Abderrahmane Sissako, Kessen Tall",Amine Bouhafa,Sofian El Fani,Amy Sow,Arches Films,,,0
Relatos salvajes,Damián Szifron,Argentina,2014​,"Antología, Suspense, Drama, Humor Absurdo, Comedia Oscura",122,"Ricardo Darín, Oscar Martínez, Leonardo SbaragliaÉrica Rivas, Rita Cortese, Julieta Zylberberg, Darío Grandinetti",Español,"Agustín Almodóvar, Pedro Almodóvar, Esther García, Matías Mosteirín, Felipe Photiades, Gerardo Rozín, Hugo Sigman, Axel Kuschevatzky",Damián Szifron,Gustavo Santaolalla,Javier Juliá,,"Kramer & Sigman Films, El Deseo, Telefe, Corner Contenidos",4000000,30642000000000,0
El hijo de Saúl,László Nemes,Hungría,2015​,Drama,107,"Géza Röhrig, Levente Molnár, Urs Rechn",Húngaro,"Gábor Sipos, Gábor Rajna","László Nemes, Clara Royer",László Melis,Mátyás Erdély,Edit Szűcs,Laokoon Filmgroup,,,1
